Product ID,Product Name,Price,Images,About this Item
B0CB6BZ244,"Samsung Galaxy Z Flip5 5G AI Smartphone (Graphite, 8GB RAM, 256GB Storage)","₹96,999",https://m.media-amazon.com/images/I/71U+YdsvMPL._AC_UY218_.jpg," Style and function that fits in your pocket. It's a pocket-sized statement piece. Small but mighty when folded, this phone is compact enough to fit in your palm, but leaves a big impression with sleek, hazy colors that match your vibe. Our toughest Samsung Galaxy foldables ever. The world’s first water-resistant foldable smartphones have never been so strong. These scratch-defying devices are our toughest ever with exclusive Corning Gorilla Glass Victus2 on the outside and the super durable Ultra Thin Glass on the inside. And the hinge is protected by Armor Aluminum — our toughest aluminum frame. Cameras that capture life with new perspective. Take advantage of this camera phone’s agile angles. Quick Shot lets you shoot a selfie right from the Cover Screen, even allowing a ratio change to show you the full frame before you shoot. Or unfold and take position with FlexCam holding up the camera so you can get a hands-free group shot or selfie at mind-blowing perspectives. Faster charging speed. Longer battery life. An upgraded 4nm processor works with the long-lasting 3700mAh (typical) battery to power through the hours. When it's low, plug in for Super Fast Charging, or bypass the cord with Fast Wireless Charging 2.0 With all that power to spare, you can even share a charge with your friend or your earbuds with Wireless PowerShare. › See more product details"
B0CJXQX3MB,SAMSUNG Galaxy S23 FE 5G (Graphite 128 GB Storage) (8 GB RAM),"₹39,375",https://m.media-amazon.com/images/I/61-E0V81kBL._AC_UY218_.jpg," Premium Design & Display: Experience the iconic design heritage of Galaxy S23, specially crafted for all passionate Galaxy fans. Camera: Experience Galaxy S23 FE’s cutting edge camera. All of your photos and videos can be epic when you use the various pro-grade features. Performance: S23 FE offers a better & smoother gaming experience with powerful performance, intelligent display & long-lasting battery. › See more product details"
B0B4JSWV8T,7SEVEN® Suitable for Xiaomi mi 12 pro 5g tempered glass screen protector guard with edge-to-edge full glue mobile screen Protector from anti scratch,₹499,https://m.media-amazon.com/images/I/51AL7FDYTpL._AC_UY218_.jpg, [ Suitable ] : Tempered glass suitable for xiaomi mi 12 pro 5g tempered glass [ Tempered glass ] : It's 100% edge to edge full curved tempered glass to protect screen device from scratches. HD RETINA CLARITY & RESPONSE: Transparent and oleo-phobic anti-smudge coating maintain your MI 12 pro Phone's original high-definition retina viewing 9H Hardness: Tempered glass durability rated at 9H hardness to protect from everyday scratches [ SMOOTH FEEL ]: Tempered Glass feels far smoother than plastic screen protectors. › See more product details
B0D1VLPN2W,"Samsung Galaxy M15 5G (Celestial Blue,8GB RAM,128GB Storage)| 50MP Triple Cam| 6000mAh Battery|MediaTek Dimensity 6100+| 4 Gen. OS Upgrade & 5 Year Security Update|Super AMOLED Display|Without Charger","₹15,999",https://m.media-amazon.com/images/I/81HaKFx7EGL._AC_UY218_.jpg," DISPLAY - 16.39 Centimeters (6.5""Inch) Super AMOLED Display with 19.5:9 Aspect Ratio, FHD+ Resolution with 1080 x 2340 Pixels , 399 PPI with 16M Colors and 90Hz Refresh Rate CAMERA - 50MP (F1.8) Main Wide Angle Camera + 5MP (F2.2) Ultra Wide Angle Camera + 2MP (F2.4) Macro Angle Camera | 13MP (F2.0) Front Camera | Video Maximum Resolution of Full HD (1920 x 1080) @30fps INTERFACE & PROCESSOR - Latest Android 14 Operating System having One UI 6.1 platform with MediaTek Dimensity 6100+ Processor | 2.2GHz, 2GHz Clock Speed with Octa-Core Processor BATTERY - Get a massive 6000mAh Lithium-ion Battery (Non-Removable) with C-Type Super Fast Charging (25W Charging Support) OS UPDATES & SECURITY - Get upto 4 Generations of AndroidOS Upgrades & 5 Years of Security Updates with Samsung Galaxy M15. Includes 1 Year Manufacturer Warranty for Device and 6 Months for In-Box Accessories. › See more product details"
B0CS5Z3T4M,"Samsung Galaxy S24 Ultra 5G AI Smartphone (Titanium Black, 12GB, 256GB Storage)","₹1,29,999",https://m.media-amazon.com/images/I/71RVuBs3q9L._AC_UY218_.jpg," Meet Galaxy S24 Ultra, the ultimate form of Galaxy Ultra with a new titanium exterior and a 17.25cm (6.8"") flat display. It's an absolute marvel of design. The legacy of Galaxy Note is alive and well. Write, tap and navigate with precision your fingers wish they had on the new, flat display. With the most megapixels on a smartphone and AI processing, Galaxy S24 Ultra sets the industry standard for image quality every time you hit the shutter. What's more, the new ProVisual engine recognizes objects — improving colour tone, reducing noise and bringing out detail. A new way to search is here with Circle to Search. While scrolling your fav social network, use your S Pen or finger to circle something and get Google Search results. Victory can be yours with the new Snapdragon 8 Gen 3 for Galaxy. Faster processing gives you the power you need for all the gameplay you want. Then, manifest graphic effects in real time with ray tracing for hyper-realistic shadows and reflections. › See more product details"
B09DG7YQR1,"Samsung Galaxy Watch4 Classic LTE (4.6cm, Black)","₹10,849",https://m.media-amazon.com/images/I/61ftRB6KycL._AC_UY218_.jpg," Only compatible with Android Smartphones (Runs on Wear OS Powered by Samsung) Bioelectrical Impedance Analysis Sensor for Body Composition Analysis, Optical Heart Rate Sensor. Health Monitoring features such as Advanced Sleep Analysis & Women's Health. Enhanced Fitness tracking lets you track 90+ workouts; Enriched App availability and connectivity with Wear OS, Powered by Samsung. Typical Usage Time (Hours): up to 40 Hours. Included Components: ‎Galaxy Watch::Watch Strap::Wireless Charger::Quick Start Quide; Connectivity Technology: Usb; Item Type Name: Smart Watch Only compatible with Android Smartphones (Runs on Wear OS Powered by Samsung) Bioelectrical Impedance Analysis Sensor for Body Composition Analysis, Optical Heart Rate Sensor.; Health Monitoring features such as Advanced Sleep Analysis & Women's Health. Enhanced Fitness tracking lets you track 90+ workouts; Enriched App availability and connectivity with Wear OS, Powered by Samsung. Typical Usage Time (Hours): up to 40 Hours. Included Components: ?Galaxy Watch::Watch Strap::Wireless Charger::Quick Start Quide; Connectivity Technology: Usb; Item Type Name: Smart Watch Model: Yd-Sx-De-An-0415-A-12; Compatible Phone Models: Android Devices; Battery Power: 361.0mAH; Age Range Description: Adult; Target Gender: Female; Item Weight: 52.0g Show More"
B0BTYWFXKC,"Samsung Galaxy S23 Ultra 5G (Green, 12GB, 256GB Storage)","₹92,799",https://m.media-amazon.com/images/I/51hqXIAVXAL._AC_UY218_.jpg," CAPTURE THE NIGHT IN LOW LIGHT: Whether you’re headed to a concert or romantic night out, there’s no such thing as bad lighting with Night Mode; Galaxy S23 Ultra lets you capture epic content in any setting with stunning Nightography HIGHEST PHONE CAMERA RESOLUTION: Create crystal-clear content worth sharing with Galaxy S23 Ultra’s 200MP camera — the highest camera resolution on a phone; Whether you’re posting or printing, Galaxy S23 Ultra always does the moment justice STUNNINGLY SMOOTH VIDEO: Capture incredibly smooth video during life’s most exciting moments; With Video Stabilization, this smartphone easily records daytime outdoor adventures or those spur-of-the-moment dance parties at night WRITE, DRAW, CREATE w/ S PEN: Whether you’re in Samsung Note, Microsoft Office or Google Suite, with the built-in S Pen, you can convert handwriting to text, share your creations live and keep everything on your Galaxy S23 Ultra device SNAP PICS w/ S PEN: Capture epic selfies and beautiful photos with the click of your S Pen; Simply open up the camera app and click the button on the S Pen instead of the screen; Getting that great shot just got easier › See more product details"
B0CB68L19S,"Samsung Galaxy Z Fold5 5G AI Smartphone (Beige, 12GB RAM, 512GB Storage)","₹1,64,999",https://m.media-amazon.com/images/I/716pi7fRTpL._AC_UY218_.jpg," Stands out. Stands up. Unfolds. The Galaxy Z Fold5 does a lot in one hand with its 15.73 cm(6.2-inch) Cover Screen. Unfolded, the 19.21 cm(7.6-inch) Main Screen lets you really get into the zone. Pushed-back bezels and the Under Display Camera means there's more screen and no black dot getting between you and the breathtaking Infinity Flex Display. Do more than more with Multi View. Whether toggling between texts or catching up on emails, take full advantage of the expansive Main Screen with Multi View. PC-like power in your pocket transforms apps optimized with One UI to give you menus and more in a glance New Taskbar for PC-like multitasking. Wipe out tasks in fewer taps. Add apps to the Taskbar for quick navigation and bouncing between windows when you're in the groove. And with App Pair, one tap launches up to three apps, all sharing one super-productive screen Our toughest Samsung Galaxy foldables ever. From the inside out, Galaxy Z Fold5 is made with materials that are not only stunning, but stand up to life's bumps and fumbles. The front and rear panels, made with exclusive Corning Gorilla Glass Victus2, are ready to resist sneaky scrapes and scratches. With our toughest aluminum frame made with Armor Aluminum, this is one durable smartphone. World’s first water resistant foldable smartphones. Be adventurous, rain or shine. You don't have to sweat the forecast when you've got one of the world's first water-resistant foldable smartphones. › See more product details"
B09P7G7Y95,"Samsung Galaxy S21 FE 5G (Graphite, 8GB, 128GB Storage)","₹31,990",https://m.media-amazon.com/images/I/81cHpJNr07L._AC_UY218_.jpg," Pro-grade Camera with AI Single Take, Portrait Mode, Night Mode and 30X Space zoom. Dual Recording: Film in both wide and selfie angles at the same time | 12MP F1.8 Main Camera (Dual Pixel AF & OIS) + 12MP UltraWide Camera (123° FOV) + 8MP Telephoto Camera (3x Optic Zoom, 30X Space Zoom, OIS) | 32 MP F2.2 Front Camera 16.28cm (6.4-inch) Dynamic AMOLED 2X Display with120Hz Refresh rate for Smooth scrolling. Intelligent Eye Comfort Shield, New 19.5:9 Screen Ratio with thinner bezel, 1080x2340 (FHD+) Resolution 5G Ready with Octa-core Exynos 2100 (5nm) Processor. Android 12 operating system. Dual Sim. Iconic Contour Cut Design with 7.9 mm thickness. Gorilla Glass Victus and IP68 Water Resistant . 4500 mAh battery with Super Fast Charging & Fast Wireless Charging. Wireless PowerShare to charge your compatible devices using your phone. Samsung DeX connectivity. Stereo Speakers sound by AKG. Dolby Atmos. › See more product details"
B0CB6B25BZ,"Samsung Galaxy Z Fold5 5G AI Smartphone (Black, 12GB RAM, 512GB Storage)","₹1,64,999",https://m.media-amazon.com/images/I/71RLYJvBidL._AC_UY218_.jpg," Stands out. Stands up. Unfolds. The Galaxy Z Fold5 does a lot in one hand with its 15.73 cm(6.2-inch) Cover Screen. Unfolded, the 19.21 cm(7.6-inch) Main Screen lets you really get into the zone. Pushed-back bezels and the Under Display Camera means there's more screen and no black dot getting between you and the breathtaking Infinity Flex Display. Do more than more with Multi View. Whether toggling between texts or catching up on emails, take full advantage of the expansive Main Screen with Multi View. PC-like power in your pocket transforms apps optimized with One UI to give you menus and more in a glance New Taskbar for PC-like multitasking. Wipe out tasks in fewer taps. Add apps to the Taskbar for quick navigation and bouncing between windows when you're in the groove. And with App Pair, one tap launches up to three apps, all sharing one super-productive screen Our toughest Samsung Galaxy foldables ever. From the inside out, Galaxy Z Fold5 is made with materials that are not only stunning, but stand up to life's bumps and fumbles. The front and rear panels, made with exclusive Corning Gorilla Glass Victus2, are ready to resist sneaky scrapes and scratches. With our toughest aluminum frame made with Armor Aluminum, this is one durable smartphone. World’s first water resistant foldable smartphones. Be adventurous, rain or shine. You don't have to sweat the forecast when you've got one of the world's first water-resistant foldable smartphones. › See more product details"
B0CMLGZ1C5,"(Refurbished) Samsung Galaxy Tab A9+ 27.94 cm (11.0 inch) Display, RAM 8 GB, ROM 128 GB Expandable, Wi-Fi Tablet, Gray","₹14,241",https://m.media-amazon.com/images/I/61afkty1foL._AC_UY218_.jpg," This Renewed product is tested to work and look like new with minimal to no signs of wear & tear; the product comes with relevant accessories and is backed by a minimum six month seller warranty; box may be generic Outstanding vividness with 27.94 cm (11.0”) LCD display, 90 Hz Refresh Rate, 1920 x 1200 (WQXGA) Qualcomm Snapdragon SM6375 Processor 8 MP AF Rear Camera, 5 MP FF Front camera,Quad Speakers Surround Sound 5100 mAh Battery, Physical SIM (nano) › See more product details"
B0CYQ2N8JR,"Samsung Galaxy M15 5G (Celestial Blue,6GB RAM,128GB Storage)| 50MP Triple Cam| 6000mAh Battery|MediaTek Dimensity 6100+| 4 Gen. OS Upgrade & 5 Year Security Update|Super AMOLED Display|Without Charger","₹14,499",https://m.media-amazon.com/images/I/81HaKFx7EGL._AC_UY218_.jpg," DISPLAY - 16.39 Centimeters (6.5""Inch) Super AMOLED Display with 19.5:9 Aspect Ratio, FHD+ Resolution with 1080 x 2340 Pixels , 399 PPI with 16M Colors and 90Hz Refresh Rate CAMERA - 50MP (F1.8) Main Wide Angle Camera + 5MP (F2.2) Ultra Wide Angle Camera + 2MP (F2.4) Macro Angle Camera | 13MP (F2.0) Front Camera | Video Maximum Resolution of Full HD (1920 x 1080) @30fps INTERFACE & PROCESSOR - Latest Android 14 Operating System having One UI 6.1 platform with MediaTek Dimensity 6100+ Processor | 2.2GHz, 2GHz Clock Speed with Octa-Core Processor BATTERY - Get a massive 6000mAh Lithium-ion Battery (Non-Removable) with C-Type Super Fast Charging (25W Charging Support) OS UPDATES & SECURITY - Get upto 4 Generations of AndroidOS Upgrades & 5 Years of Security Updates with Samsung Galaxy M15. Includes 1 Year Manufacturer Warranty for Device and 6 Months for In-Box Accessories. › See more product details"
B0CQPGG8KG,"Redmi Note 13 5G (Arctic White, 6GB RAM, 128GB Storage) | 5G Ready | 120Hz Bezel-Less AMOLED | 7.mm Slimmest Note Ever | 108MP Pro-Grade Camera","₹16,999",https://m.media-amazon.com/images/I/71VW8LmqqPL._AC_UY218_.jpg," Display: 6.67"" FHD+ pOLED (1080x2400) Ultra-narrow bezels Display with 120Hz Refresh rate; 1000nits peak brightness; Corning Gorilla Glass 5 Display Protection Processor:Mediatek Dimensity 6080 6nm Octa-core 5G processor for high performance ; Up to 2.4GHz; Upto 12GB RAM including 6GB Virtual RAM Camera: 108MP 3X in-sensor zoom AI Triple Camera with 8MP Ultra Wide sensor and 2MP Macro camera| 16MP Front camera Battery: 5000 mAh large battery with 33W fast charger in-box and Type-C connectivity Memory, Storage & SIM: 6GB RAM | 128GB UFS 2.2 | Dual SIM (nano+nano) 5G › See more product details"
B0CJ38X1BQ,"Samsung Galaxy Tab A9+ 27.94 cm (11.0 inch) Display, RAM 8 GB, ROM 128 GB Expandable, Wi-Fi Tablet, Graphite","₹18,990",https://m.media-amazon.com/images/I/61afkty1foL._AC_UY218_.jpg," Outstanding vividness with 27.94 cm (11.0 ) LCD display, 90 Hz Refresh Rate, 1920 x 1200 (WQXGA) Qualcomm Snapdragon SM6375 Processor 8 MP AF Rear Camera, 5 MP FF Front camera,Quad Speakers Surround Sound 7040 mAh Battery Memory Storage Capacity: 128.0GB; Ram Memory Installed Size: 8.0GB; Battery Capacity: 7040.0 mAH; Special Features: Fast Charging › See more product details"
B0CMTZNPXR,"Redmi 13C (Starshine Green, 4GB RAM, 128GB Storage) | Powered by 4G MediaTek Helio G85 | 90Hz Display | 50MP AI Triple Camera","₹7,699",https://m.media-amazon.com/images/I/71hj88T5aBL._AC_UY218_.jpg," Processor: High performance MediaTek G85 ; Enhance gaming with 1GHz GPU | 8GB of RAM including 4GB virtual | 6.74"" HD+ 90Hz display with Corning Gorilla Glass 3 Protection | 50MP AI Triple camera |Fast Side fingerprint | 5000mAh Battery 6.74"" HD+ 90Hz display with Corning Gorilla Glass 3 Protection, 600nits in High Brightness mode 50MP AI Triple camera with Primary sensor of f/1.8 (4-in-1 super pixel) with the following modes: Photo | Portrait | Night | Video | 50MP mode | Time-lapse | Classic film filters | Frame | HDR | Google lens | Voice Shutter › See more product details"
B08VB57558,"Samsung Galaxy S20 FE 5G (Cloud Navy, 8GB RAM, 128GB Storage) with No Cost EMI & Additional Exchange Offers",No price,https://m.media-amazon.com/images/I/81vDZyJQ-4L._AC_UY218_.jpg," 5G Ready powered by Qualcomm Snapdragon 865 Octa-Core processor, 8GB RAM, 128GB internal memory expandable up to 1TB, Android 11.0 operating system and dual SIM Triple Rear Camera Setup - 12MP (Dual Pixel) OIS F1.8 Wide Rear Camera + 8MP OIS Tele Camera + 12MP Ultra Wide | 30X Space Zoom, Single Take & Night Mode | 32MP F2.2 Front Punch Hole Camera 6.5-inch(16.40 centimeters) Infinity-O Super AMOLED Display with 120Hz Refresh rate, 1080 x 2400 (FHD+) Resolution "" 4500 mAh battery (Non -removable) with Super Fast Charging, FAst Wireless Charging & Finger Print sensor IP68 Rated, MicroSD Card Slot (Expandable upto 1 TB), Dual Nano Sim, Hybrid Sim Slot, 5G+5G Dual stand by Disclaimer: N28 band for Stand alone 5G network is not compatible › See more product details"
B0CB6BCJYS,"Samsung Galaxy Z Flip5 5G AI Smartphone (Mint, 8GB RAM, 512GB Storage)","₹1,09,999",https://m.media-amazon.com/images/I/61Tl1z+Hn0L._AC_UY218_.jpg," Style and function that fits in your pocket. It's a pocket-sized statement piece. Small but mighty when folded, this phone is compact enough to fit in your palm, but leaves a big impression with sleek, hazy colors that match your vibe. Our toughest Samsung Galaxy foldables ever. The world’s first water-resistant foldable smartphones have never been so strong. These scratch-defying devices are our toughest ever with exclusive Corning Gorilla Glass Victus2 on the outside and the super durable Ultra Thin Glass on the inside. And the hinge is protected by Armor Aluminum — our toughest aluminum frame. Cameras that capture life with new perspective. Take advantage of this camera phone’s agile angles. Quick Shot lets you shoot a selfie right from the Cover Screen, even allowing a ratio change to show you the full frame before you shoot. Or unfold and take position with FlexCam holding up the camera so you can get a hands-free group shot or selfie at mind-blowing perspectives. Faster charging speed. Longer battery life. An upgraded 4nm processor works with the long-lasting 3700mAh (typical) battery to power through the hours. When it's low, plug in for Super Fast Charging, or bypass the cord with Fast Wireless Charging 2.0 With all that power to spare, you can even share a charge with your friend or your earbuds with Wireless PowerShare. › See more product details"
B0CS5XW6TN,"Samsung Galaxy S24 Ultra 5G AI Smartphone (Titanium Gray, 12GB, 256GB Storage)","₹1,29,999",https://m.media-amazon.com/images/I/81vxWpPpgNL._AC_UY218_.jpg," Meet Galaxy S24 Ultra, the ultimate form of Galaxy Ultra with a new titanium exterior and a 17.25cm (6.8"") flat display. It's an absolute marvel of design. The legacy of Galaxy Note is alive and well. Write, tap and navigate with precision your fingers wish they had on the new, flat display. With the most megapixels on a smartphone and AI processing, Galaxy S24 Ultra sets the industry standard for image quality every time you hit the shutter. What's more, the new ProVisual engine recognizes objects — improving colour tone, reducing noise and bringing out detail. A new way to search is here with Circle to Search. While scrolling your fav social network, use your S Pen or finger to circle something and get Google Search results. Victory can be yours with the new Snapdragon 8 Gen 3 for Galaxy. Faster processing gives you the power you need for all the gameplay you want. Then, manifest graphic effects in real time with ray tracing for hyper-realistic shadows and reflections. › See more product details"
B0CKL7XHSY,"Samsung Galaxy F34 5G (Mistic Green, 8 GB RAM, 128 GB Storage) | 50 MP No Shake Camera | Auto Night Mode | 120 Hz AMOLED Display | 4K Videos | 6000 mAh Large Battery | Dolby Atmos | Gorilla Glass 5","₹15,915",https://m.media-amazon.com/images/I/71Ffo+fLvaL._AC_UY218_.jpg, Gorilla Glass Camera › See more product details
B0CP7VSGXG,"Samsung Galaxy A15 5G (Light Blue, 8GB, 256GB Storage) | 50 MP Main Camera | Android 14 with One UI 6.0 | 16GB Expandable RAM | MediaTek Dimensity 6100+ | 5000 mAh Battery","₹22,499",https://m.media-amazon.com/images/I/71afOijnhAL._AC_UY218_.jpg," DISPLAY - 16.39 Centimeters (6.5""Inch) Super AMOLED Display with 19.5:9 Aspect Ratio, FHD+ Resolution with 1080 x 2340 Pixels , 399 PPI with 16M Colours and 90Hz Refresh Rate, Dragon Trail-Pro Glass Type CAMERA - 50MP (F1.8) Main Wide Angle Camera + 5MP (F2.2) Ultra Wide Camera + 2MP (F2.4) Macro Camera | 13MP (F2.0) Front Camera | Video Maximum Resolution of Full HD (1920 x 1080) @30fps INTERFACE & PROCESSOR - Latest Android 14 Operating System having One UI 6.0 platform with MediaTek Dimensity 6100+ | 2.2GHz, 2GHz 6nm Octa-Core Processor BATTERY - Get a massive 5000mAh Lithium-ion Battery (Non-Removable) with C-Type Super Fast Charging (25W Charging Support) OS UPDATES & SECURITY - Get upto 4 Generations of AndroidOS Upgrades & 5 Years of Security Updates with Samsung Galaxy A15. Includes 1 Year Manufacturer Warranty for Device and 6 Months for In-Box Accessories. › See more product details"
B0CYQ3D6VJ,"Samsung Galaxy M15 5G (Blue Topaz,4GB RAM,128GB Storage)| 50MP Triple Cam| 6000mAh Battery| MediaTek Dimensity 6100+| 4 Gen. OS Upgrade & 5 Year Security Update| Super AMOLED Display| Without Charger","₹12,999",https://m.media-amazon.com/images/I/81BTRVfsuFL._AC_UY218_.jpg," DISPLAY - 16.39 Centimeters (6.5""Inch) Super AMOLED Display with 19.5:9 Aspect Ratio, FHD+ Resolution with 1080 x 2340 Pixels , 399 PPI with 16M Colors and 90Hz Refresh Rate CAMERA - 50MP (F1.8) Main Wide Angle Camera + 5MP (F2.2) Ultra Wide Angle Camera + 2MP (F2.4) Macro Angle Camera | 13MP (F2.0) Front Camera | Video Maximum Resolution of Full HD (1920 x 1080) @30fps INTERFACE & PROCESSOR - Latest Android 14 Operating System having One UI 6.1 platform with MediaTek Dimensity 6100+ Processor | 2.2GHz, 2GHz Clock Speed with Octa-Core Processor BATTERY - Get a massive 6000mAh Lithium-ion Battery (Non-Removable) with C-Type Super Fast Charging (25W Charging Support) OS UPDATES & SECURITY - Get upto 4 Generations of AndroidOS Upgrades & 5 Years of Security Updates with Samsung Galaxy M15. Includes 1 Year Manufacturer Warranty for Device and 6 Months for In-Box Accessories. › See more product details"
B0B4JSWV8T,7SEVEN® Suitable for Xiaomi mi 12 pro 5g tempered glass screen protector guard with edge-to-edge full glue mobile screen Protector from anti scratch,₹499,https://m.media-amazon.com/images/I/51AL7FDYTpL._AC_UY218_.jpg, [ Suitable ] : Tempered glass suitable for xiaomi mi 12 pro 5g tempered glass [ Tempered glass ] : It's 100% edge to edge full curved tempered glass to protect screen device from scratches. HD RETINA CLARITY & RESPONSE: Transparent and oleo-phobic anti-smudge coating maintain your MI 12 pro Phone's original high-definition retina viewing 9H Hardness: Tempered glass durability rated at 9H hardness to protect from everyday scratches [ SMOOTH FEEL ]: Tempered Glass feels far smoother than plastic screen protectors. › See more product details
B0CP7W9ZDZ,"Samsung Galaxy A15 5G (Blue, 6GB, 128GB Storage) | 50 MP Main Camera | Android 14 with One UI 6.0 | 12GB Expandable RAM | MediaTek Dimensity 6100+ | 5000 mAh Battery","₹17,999",https://m.media-amazon.com/images/I/71+0MKV37HL._AC_UY218_.jpg," DISPLAY - 16.39 Centimeters (6.5""Inch) Super AMOLED Display with 19.5:9 Aspect Ratio, FHD+ Resolution with 1080 x 2340 Pixels , 399 PPI with 16M Colours and 90Hz Refresh Rate, Dragon Trail-Pro Glass Type CAMERA - 50MP (F1.8) Main Wide Angle Camera + 5MP (F2.2) Ultra Wide Camera + 2MP (F2.4) Macro Camera | 13MP (F2.0) Front Camera | Video Maximum Resolution of Full HD (1920 x 1080) @30fps INTERFACE & PROCESSOR - Latest Android 14 Operating System having One UI 6.0 platform with MediaTek Dimensity 6100+ | 2.2GHz, 2GHz 6nm Octa-Core Processor BATTERY - Get a massive 5000mAh Lithium-ion Battery (Non-Removable) with C-Type Super Fast Charging (25W Charging Support) OS UPDATES & SECURITY - Get upto 4 Generations of AndroidOS Upgrades & 5 Years of Security Updates with Samsung Galaxy A15. Includes 1 Year Manufacturer Warranty for Device and 6 Months for In-Box Accessories. › See more product details"
